{
  "id": "js_test_pattern_104",
  "description": "Generated from js_test_pattern_104.pattern",
  "input_dsl": "^a$\n",
  "input_ast": {
    "type": "Sequence",
    "parts": [
      {
        "type": "Anchor",
        "at": "Start"
      },
      {
        "type": "Literal",
        "value": "a"
      },
      {
        "type": "Anchor",
        "at": "End"
      },
      {
        "type": "Literal",
        "value": "\n"
      }
    ]
  },
  "flags": {
    "ignoreCase": false,
    "multiline": false,
    "dotAll": false,
    "unicode": false,
    "extended": false
  },
  "expected_ir": {
    "ir": "Seq",
    "parts": [
      {
        "ir": "Anchor",
        "at": "Start"
      },
      {
        "ir": "Lit",
        "value": "a"
      },
      {
        "ir": "Anchor",
        "at": "End"
      },
      {
        "ir": "Lit",
        "value": "\n"
      }
    ]
  },
  "expected_codegen": {
    "success": true,
    "pcre": "^a$\n"
  },
  "metadata_expectations": {
    "features_used": []
  }
}