{
  "id": "plain_literal_underscore",
  "description": "Generated from plain_literal_underscore.json",
  "input_dsl": "_",
  "input_ast": {
    "type": "Literal",
    "value": "_"
  },
  "flags": {
    "ignoreCase": false,
    "multiline": false,
    "dotAll": false,
    "unicode": false,
    "extended": false
  },
  "expected_ir": {
    "ir": "Lit",
    "value": "_"
  },
  "expected_codegen": {
    "success": true,
    "pcre": "_"
  },
  "metadata_expectations": {
    "features_used": []
  }
}