{
  "id": "range_with_escaped_endpoints",
  "description": "Generated from range_with_escaped_endpoints.pattern",
  "input_dsl": "[\\x41-\\x5A]",
  "input_ast": {
    "type": "CharacterClass",
    "negated": false,
    "members": [
      {
        "type": "Range",
        "from": "A",
        "to": "Z"
      }
    ]
  },
  "flags": {
    "ignoreCase": false,
    "multiline": false,
    "dotAll": false,
    "unicode": false,
    "extended": false
  },
  "expected_ir": {
    "ir": "CharClass",
    "negated": false,
    "items": [
      {
        "ir": "Range",
        "from": "A",
        "to": "Z"
      }
    ]
  },
  "expected_codegen": {
    "success": true,
    "pcre": "[A-Z]"
  },
  "metadata_expectations": {
    "features_used": []
  }
}