{
  "id": "js_test_pattern_37",
  "description": "Generated from js_test_pattern_37.pattern",
  "input_dsl": "(?=[a-z])\n",
  "input_ast": {
    "type": "Sequence",
    "parts": [
      {
        "type": "Lookahead",
        "body": {
          "type": "CharacterClass",
          "negated": false,
          "members": [
            {
              "type": "Range",
              "from": "a",
              "to": "z"
            }
          ]
        }
      },
      {
        "type": "Literal",
        "value": "\n"
      }
    ]
  },
  "flags": {
    "ignoreCase": false,
    "multiline": false,
    "dotAll": false,
    "unicode": false,
    "extended": false
  },
  "expected_ir": {
    "ir": "Seq",
    "parts": [
      {
        "ir": "Look",
        "dir": "Ahead",
        "neg": false,
        "body": {
          "ir": "CharClass",
          "negated": false,
          "items": [
            {
              "ir": "Range",
              "from": "a",
              "to": "z"
            }
          ]
        }
      },
      {
        "ir": "Lit",
        "value": "\n"
      }
    ]
  },
  "expected_codegen": {
    "success": true,
    "pcre": "(?=[a-z])\n"
  },
  "metadata_expectations": {
    "features_used": []
  }
}