{
  "id": "js_test_pattern_318",
  "description": "Generated from js_test_pattern_318.json",
  "input_dsl": "(\\*)\n",
  "input_ast": {
    "type": "Sequence",
    "parts": [
      {
        "type": "Group",
        "capturing": true,
        "body": {
          "type": "Literal",
          "value": "*"
        },
        "expression": {
          "type": "Literal",
          "value": "*"
        },
        "name": null,
        "atomic": false
      },
      {
        "type": "Literal",
        "value": "\n"
      }
    ]
  },
  "flags": {
    "ignoreCase": false,
    "multiline": false,
    "dotAll": false,
    "unicode": false,
    "extended": false
  },
  "expected_ir": {
    "ir": "Seq",
    "parts": [
      {
        "ir": "Group",
        "capturing": true,
        "body": {
          "ir": "Lit",
          "value": "*"
        }
      },
      {
        "ir": "Lit",
        "value": "\n"
      }
    ]
  },
  "expected_codegen": {
    "success": true,
    "pcre": "(\\*)\n"
  },
  "metadata_expectations": {
    "features_used": []
  }
}