{
  "id": "lookbehind_pos",
  "description": "Generated from lookbehind_pos.pattern",
  "input_dsl": "(?<=a)b",
  "input_ast": {
    "type": "Sequence",
    "parts": [
      {
        "type": "Lookbehind",
        "body": {
          "type": "Literal",
          "value": "a"
        }
      },
      {
        "type": "Literal",
        "value": "b"
      }
    ]
  },
  "flags": {
    "ignoreCase": false,
    "multiline": false,
    "dotAll": false,
    "unicode": false,
    "extended": false
  },
  "expected_ir": {
    "ir": "Seq",
    "parts": [
      {
        "ir": "Look",
        "dir": "Behind",
        "neg": false,
        "body": {
          "ir": "Lit",
          "value": "a"
        }
      },
      {
        "ir": "Lit",
        "value": "b"
      }
    ]
  },
  "expected_codegen": {
    "success": true,
    "pcre": "(?<=a)b"
  },
  "metadata_expectations": {
    "features_used": []
  }
}