{
  "id": "control_escape_vertical_tab",
  "description": "Generated from control_escape_vertical_tab.json",
  "input_dsl": "\\v",
  "input_ast": {
    "type": "Literal",
    "value": "\u000b"
  },
  "flags": {
    "ignoreCase": false,
    "multiline": false,
    "dotAll": false,
    "unicode": false,
    "extended": false
  },
  "expected_ir": {
    "ir": "Lit",
    "value": "\u000b"
  },
  "expected_codegen": {
    "success": true,
    "pcre": "\u000b"
  },
  "metadata_expectations": {
    "features_used": []
  }
}