{
  "id": "escaped_null_byte",
  "description": "Generated from escaped_null_byte.json",
  "input_dsl": "\\\\0",
  "input_ast": {
    "type": "Sequence",
    "parts": [
      {
        "type": "Literal",
        "value": "\\"
      },
      {
        "type": "Literal",
        "value": "0"
      }
    ]
  },
  "flags": {
    "ignoreCase": false,
    "multiline": false,
    "dotAll": false,
    "unicode": false,
    "extended": false
  },
  "expected_ir": {
    "ir": "Lit",
    "value": "\\0"
  },
  "expected_codegen": {
    "success": true,
    "pcre": "\\\\0"
  },
  "metadata_expectations": {
    "features_used": []
  }
}