{
  "id": "absolute_start_ext",
  "description": "Generated from absolute_start_ext.pattern",
  "input_dsl": "\\A",
  "input_ast": {
    "type": "Anchor",
    "at": "AbsoluteStart"
  },
  "flags": {
    "ignoreCase": false,
    "multiline": false,
    "dotAll": false,
    "unicode": false,
    "extended": false
  },
  "expected_ir": {
    "ir": "Anchor",
    "at": "AbsoluteStart"
  },
  "expected_codegen": {
    "success": true,
    "pcre": "\\A"
  },
  "metadata_expectations": {
    "features_used": []
  }
}