{
  "id": "numeric_backref",
  "description": "Generated from numeric_backref.pattern",
  "input_dsl": "(a)\\1",
  "input_ast": {
    "type": "Sequence",
    "parts": [
      {
        "type": "Group",
        "capturing": true,
        "body": {
          "type": "Literal",
          "value": "a"
        },
        "expression": {
          "type": "Literal",
          "value": "a"
        },
        "name": null,
        "atomic": false
      },
      {
        "type": "Backreference",
        "index": 1,
        "name": null
      }
    ]
  },
  "flags": {
    "ignoreCase": false,
    "multiline": false,
    "dotAll": false,
    "unicode": false,
    "extended": false
  },
  "expected_ir": {
    "ir": "Seq",
    "parts": [
      {
        "ir": "Group",
        "capturing": true,
        "body": {
          "ir": "Lit",
          "value": "a"
        }
      },
      {
        "ir": "Backref",
        "byIndex": 1
      }
    ]
  },
  "expected_codegen": {
    "success": true,
    "pcre": "(a)\\1"
  },
  "metadata_expectations": {
    "features_used": []
  }
}