{
  "id": "comment_char_is_literal",
  "description": "Generated from comment_char_is_literal.pattern",
  "input_dsl": "%flags x\n[a#b]",
  "input_ast": {
    "type": "CharacterClass",
    "negated": false,
    "members": [
      {
        "type": "Literal",
        "value": "a"
      },
      {
        "type": "Literal",
        "value": "#"
      },
      {
        "type": "Literal",
        "value": "b"
      }
    ]
  },
  "flags": {
    "ignoreCase": false,
    "multiline": false,
    "dotAll": false,
    "unicode": false,
    "extended": true
  },
  "expected_ir": {
    "ir": "CharClass",
    "negated": false,
    "items": [
      {
        "ir": "Char",
        "char": "a"
      },
      {
        "ir": "Char",
        "char": "#"
      },
      {
        "ir": "Char",
        "char": "b"
      }
    ]
  },
  "expected_codegen": {
    "success": true,
    "pcre": "(?x)[a#b]"
  },
  "metadata_expectations": {
    "features_used": []
  }
}