{
  "id": "end_before_newline_ext",
  "description": "Generated from end_before_newline_ext.pattern",
  "input_dsl": "\\Z",
  "input_ast": {
    "type": "Anchor",
    "at": "EndBeforeFinalNewline"
  },
  "flags": {
    "ignoreCase": false,
    "multiline": false,
    "dotAll": false,
    "unicode": false,
    "extended": false
  },
  "expected_ir": {
    "ir": "Anchor",
    "at": "EndBeforeFinalNewline"
  },
  "expected_codegen": {
    "success": true,
    "pcre": "\\Z"
  },
  "metadata_expectations": {
    "features_used": []
  }
}