{
  "id": "js_test_pattern_112",
  "description": "Generated from js_test_pattern_112.pattern",
  "input_dsl": "(?>^a)\n",
  "input_ast": {
    "type": "Sequence",
    "parts": [
      {
        "type": "Group",
        "capturing": false,
        "body": {
          "type": "Sequence",
          "parts": [
            {
              "type": "Anchor",
              "at": "Start"
            },
            {
              "type": "Literal",
              "value": "a"
            }
          ]
        },
        "expression": {
          "type": "Sequence",
          "parts": [
            {
              "type": "Anchor",
              "at": "Start"
            },
            {
              "type": "Literal",
              "value": "a"
            }
          ]
        },
        "name": null,
        "atomic": true
      },
      {
        "type": "Literal",
        "value": "\n"
      }
    ]
  },
  "flags": {
    "ignoreCase": false,
    "multiline": false,
    "dotAll": false,
    "unicode": false,
    "extended": false
  },
  "expected_ir": {
    "ir": "Seq",
    "parts": [
      {
        "ir": "Group",
        "capturing": false,
        "body": {
          "ir": "Seq",
          "parts": [
            {
              "ir": "Anchor",
              "at": "Start"
            },
            {
              "ir": "Lit",
              "value": "a"
            }
          ]
        },
        "atomic": true
      },
      {
        "ir": "Lit",
        "value": "\n"
      }
    ]
  },
  "expected_codegen": {
    "success": true,
    "pcre": "(?>^a)\n"
  },
  "metadata_expectations": {
    "features_used": []
  }
}