{
  "id": "should_parse_adjacent_ranges",
  "description": "Generated from should_parse_adjacent_ranges.pattern",
  "input_dsl": "[a-z][A-Z]",
  "input_ast": {
    "type": "Sequence",
    "parts": [
      {
        "type": "CharacterClass",
        "negated": false,
        "members": [
          {
            "type": "Range",
            "from": "a",
            "to": "z"
          }
        ]
      },
      {
        "type": "CharacterClass",
        "negated": false,
        "members": [
          {
            "type": "Range",
            "from": "A",
            "to": "Z"
          }
        ]
      }
    ]
  },
  "flags": {
    "ignoreCase": false,
    "multiline": false,
    "dotAll": false,
    "unicode": false,
    "extended": false
  },
  "expected_ir": {
    "ir": "Seq",
    "parts": [
      {
        "ir": "CharClass",
        "negated": false,
        "items": [
          {
            "ir": "Range",
            "from": "a",
            "to": "z"
          }
        ]
      },
      {
        "ir": "CharClass",
        "negated": false,
        "items": [
          {
            "ir": "Range",
            "from": "A",
            "to": "Z"
          }
        ]
      }
    ]
  },
  "expected_codegen": {
    "success": true,
    "pcre": "[a-z][A-Z]"
  },
  "metadata_expectations": {
    "features_used": []
  }
}