{
  "id": "should_parse_nested_quantifier_with_brace",
  "description": "Generated from should_parse_nested_quantifier_with_brace.pattern",
  "input_dsl": "(a{2,3}){1,2}",
  "input_ast": {
    "type": "Quantifier",
    "target": {
      "type": "Group",
      "capturing": true,
      "body": {
        "type": "Quantifier",
        "target": {
          "type": "Literal",
          "value": "a"
        },
        "min": 2,
        "max": 3,
        "greedy": true,
        "lazy": false,
        "possessive": false
      },
      "expression": {
        "type": "Quantifier",
        "target": {
          "type": "Literal",
          "value": "a"
        },
        "min": 2,
        "max": 3,
        "greedy": true,
        "lazy": false,
        "possessive": false
      },
      "name": null,
      "atomic": false
    },
    "min": 1,
    "max": 2,
    "greedy": true,
    "lazy": false,
    "possessive": false
  },
  "flags": {
    "ignoreCase": false,
    "multiline": false,
    "dotAll": false,
    "unicode": false,
    "extended": false
  },
  "expected_ir": {
    "ir": "Quant",
    "child": {
      "ir": "Group",
      "capturing": true,
      "body": {
        "ir": "Quant",
        "child": {
          "ir": "Lit",
          "value": "a"
        },
        "min": 2,
        "max": 3,
        "mode": "Greedy"
      }
    },
    "min": 1,
    "max": 2,
    "mode": "Greedy"
  },
  "expected_codegen": {
    "success": true,
    "pcre": "(a{2,3}){1,2}"
  },
  "metadata_expectations": {
    "features_used": []
  }
}