{
  "id": "js_test_pattern_275",
  "description": "Generated from js_test_pattern_275.json",
  "input_dsl": "a{0,10}\n",
  "input_ast": {
    "type": "Sequence",
    "parts": [
      {
        "type": "Quantifier",
        "target": {
          "type": "Literal",
          "value": "a"
        },
        "min": 0,
        "max": 10,
        "greedy": true,
        "lazy": false,
        "possessive": false
      },
      {
        "type": "Literal",
        "value": "\n"
      }
    ]
  },
  "flags": {
    "ignoreCase": false,
    "multiline": false,
    "dotAll": false,
    "unicode": false,
    "extended": false
  },
  "expected_ir": {
    "ir": "Seq",
    "parts": [
      {
        "ir": "Quant",
        "child": {
          "ir": "Lit",
          "value": "a"
        },
        "min": 0,
        "max": 10,
        "mode": "Greedy"
      },
      {
        "ir": "Lit",
        "value": "\n"
      }
    ]
  },
  "expected_codegen": {
    "success": true,
    "pcre": "a{0,10}\n"
  },
  "metadata_expectations": {
    "features_used": []
  }
}