{
  "id": "at_least_zero",
  "description": "Generated from at_least_zero.pattern",
  "input_dsl": "a{0,}",
  "input_ast": {
    "type": "Quantifier",
    "target": {
      "type": "Literal",
      "value": "a"
    },
    "min": 0,
    "max": null,
    "greedy": true,
    "lazy": false,
    "possessive": false
  },
  "flags": {
    "ignoreCase": false,
    "multiline": false,
    "dotAll": false,
    "unicode": false,
    "extended": false
  },
  "expected_ir": {
    "ir": "Quant",
    "child": {
      "ir": "Lit",
      "value": "a"
    },
    "min": 0,
    "max": "Inf",
    "mode": "Greedy"
  },
  "expected_codegen": {
    "success": true,
    "pcre": "a*"
  },
  "metadata_expectations": {
    "features_used": []
  }
}