{
  "id": "multiple_flags_with_spaces",
  "description": "Generated from multiple_flags_with_spaces.pattern",
  "input_dsl": "%flags u m s",
  "input_ast": {
    "type": "Sequence",
    "parts": []
  },
  "flags": {
    "ignoreCase": false,
    "multiline": true,
    "dotAll": true,
    "unicode": true,
    "extended": false
  },
  "expected_ir": {
    "ir": "Seq",
    "parts": []
  },
  "expected_codegen": {
    "success": true,
    "pcre": "(?msu)"
  },
  "metadata_expectations": {
    "features_used": []
  }
}